<?xml version="1.0" encoding="utf-8"?>
<!DOCTYPE xml SYSTEM "respose_users_states.dtd">
<!-- szablon odpowiedzi na rzadanie pokazania dostepnosci kontaktow -->

<xml>
	
	<message type="respose_users_states"/>

	<users>
		<user uid="0000002">
			<status state="online">Ciagle pisze w c++ :P</status>
		</user>
		
		<user uid="0000003">
			<status state="offline">Naprawde nie ma mnie</status>
		</user>
		
		<user uid="0000004">
			<status state="invisible">Ja was widze a wy mnie nie :P</status>
		</user>
		
		<user uid="0000005">
			<status state="brb">be right back</status>
		</user>
	</users>
</xml>